{
  "$schema": "http://json-schema.org/draft-07/schema#",
  "$ref": "#/definitions/PriceBookEntry",
  "definitions": {
    "PriceBookEntry": {
      "type": "object",
      "example": {
        "id": "id1",
        "useStandardPrice": false,
        "minRequiredOrderValue": -88763183,
        "product": [
          "ea dolore in minim",
          "ipsum sunt Ut enim nostrud"
        ],
        "isActive": true,
        "servicePeriodCount": 67745648,
        "unitListPrice": 39837857,
        "maxRequiredOrderValue": null,
        "minRequiredQuantity": 66079859
      },
      "additionalProperties": true,
      "required": [
        "id"
      ],
      "properties": {
        "id": {
          "anyOf": [
            {
              "type": "string"
            },
            {
              "type": "null"
            }
          ]
        },
        "minRequiredQuantity": {
          "anyOf": [
            {
              "type": "integer"
            },
            {
              "type": "null"
            }
          ]
        },
        "unitListPrice": {
          "anyOf": [
            {
              "type": "integer"
            },
            {
              "type": "null"
            }
          ]
        },
        "product": {
          "type": "array",
          "items": {
            "type": "string"
          }
        },
        "minRequiredOrderValue": {
          "anyOf": [
            {
              "type": "integer"
            },
            {
              "type": "null"
            }
          ]
        },
        "isActive": {
          "anyOf": [
            {
              "type": "boolean"
            },
            {
              "type": "null"
            }
          ]
        },
        "maxRequiredOrderValue": {
          "anyOf": [
            {
              "type": "integer"
            },
            {
              "type": "null"
            }
          ]
        },
        "useStandardPrice": {
          "anyOf": [
            {
              "type": "boolean"
            },
            {
              "type": "null"
            }
          ]
        },
        "servicePeriodCount": {
          "anyOf": [
            {
              "type": "integer"
            },
            {
              "type": "null"
            }
          ]
        }
      }
    }
  }
}
