{
  "id": "elit dolore velit consequat",
  "minRequiredOrderValue": 84855091,
  "product": [
    "amet ea sint culpa in",
    "Excepteur fugiat non",
    "fugiat commodo Duis esse",
    "labore",
    "Excepteur in",
    "sit eu tempor est minim",
    "dolor eu ut",
    "Lorem",
    "mollit",
    "dolore minim",
    "voluptate aliquip laborum aliqua laboris",
    "dolore tempor",
    "nisi cillum",
    "laboris ea",
    "ad irure",
    "culpa eiusmod in aute dolor",
    "veniam culpa nostrud consequat voluptate",
    "officia",
    "ad occaecat veniam",
    "nostrud cupidatat eu sed",
    "occaecat in est",
    "dolore qui",
    "sunt tempor",
    "in mollit sint",
    "incididunt reprehenderit eu",
    "in occaecat",
    "Duis Excepteur sunt Ut",
    "veniam ut",
    "id",
    "Lorem",
    "sed in",
    "minim",
    "pariatur ex",
    "qui exercitation",
    "tempor proident aute est dolore",
    "eiusmod do et mollit magna",
    "ex dolore in",
    "anim magna Lorem irure aute",
    "ex cupidatat ullamco velit quis",
    "ipsum et veniam enim velit",
    "veniam ipsum elit",
    "sed deserunt amet commodo",
    "sunt minim aliqua nulla",
    "dolor voluptate anim pariatur reprehenderit",
    "nulla fugiat dolore",
    "sed amet enim dolor",
    "officia ut",
    "culpa anim do aliquip deserunt",
    "culpa esse tempor ad",
    "fugiat deserunt aute",
    "ex",
    "sunt irure consectetur nostrud",
    "in dolore laborum",
    "tempor ipsum Duis labore",
    "eiusmod",
    "nostrud"
  ],
  "maxRequiredOrderValue": -84246929
}
